{
  "schema_version": "devseek.profile-executor-contracts/v1",
  "integrity": {
    "hash_algorithm": "sha256",
    "canonicalization_version": "devseek-canonical-json/v1"
  },
  "contract_registry_id": "DEVSEEK-GATE0-PROFILE-EXECUTOR-CONTRACTS/v1",
  "contract_registry_version": 1,
  "source_status": "verified",
  "integrity_scope": "local-executor-contract-conformance",
  "qualification_eligible": false,
  "qualification_effect": "NONE",
  "claims_permitted": false,
  "asserts_gate_pass": false,
  "sources": {
    "profile_denominator_registry": {
      "path": "docs/process/devseek-profile-denominator-registry.json",
      "schema_version": "devseek.profile-denominator-registry/v1",
      "registry_id": "DEVSEEK-GATE0-PROFILE-DENOMINATOR-REGISTRY/v1",
      "source_sha256": "34476c452bf160fe783539fb3768d991fea1715ba86bd19ebb99c69c2d31b44c"
    },
    "qualification_runner_inventory": {
      "path": "docs/process/devseek-qualification-runner-inventory.json",
      "schema_version": "devseek.qualification-runner-inventory/v1",
      "inventory_sha256": "fd9b5201c3769ff4df0b936bb5b7676815e7d517076d3cfb631ebf2a91e0c9d2"
    },
    "runner_source": {
      "path": "scripts/lib/devseek-qualification-runner.mjs",
      "source_sha256": "fec73a09d3cece71dc55aee22a832de154c0594563f801e2ec6dac8cb656e5b0"
    },
    "oracle_source": {
      "path": "scripts/test/devseek-profile-executor-contracts.test.mjs",
      "source_sha256": "3305a3dcf6287fc81bf91165988a6ec484174908be9f74f5761c678359e996c3"
    }
  },
  "executor_policy": {
    "composition_root": "scripts/lib/devseek-qualification-runner.mjs#createQualificationRunner",
    "semantic_contracts_required": 5,
    "runner_root_cardinality": 1,
    "catalog_metadata_counts_as_execution": false,
    "execution_result_count": 0,
    "zero_action_attacks_per_semantic": 5,
    "independent_oracle_per_semantic": true,
    "empty_input_veto": true,
    "replacement_input_veto": true,
    "wrong_slot_or_attempt_veto": true,
    "missing_receipt_veto": true,
    "unauthorized_external_action_veto": true
  },
  "contracts": [
    {
      "contract_id": "G0-05:applicability-denominator-lowering:executor-contract/v1",
      "slot_semantic": "applicability-denominator-lowering",
      "category": "attack",
      "stage_type": "T2",
      "purpose": "Reject lowered applicability, platform, provider, or qualification level denominators.",
      "denominator_binding": {
        "denominator_registry_id": "DEVSEEK-GATE0-PROFILE-DENOMINATOR-REGISTRY/v1",
        "denominator_registry_sha256": "34476c452bf160fe783539fb3768d991fea1715ba86bd19ebb99c69c2d31b44c",
        "capability_ids": [
          "C0-CAPABILITY-LEDGER-SCHEMA",
          "C0-CASE-CATALOG",
          "C0-PREREGISTRATION-PLAN",
          "C0-QUALIFICATION-AGGREGATOR",
          "C0-QUALIFICATION-EVIDENCE-MANIFEST",
          "C0-QUALIFICATION-PROFILE-SCHEMA",
          "C0-RUN-EVIDENCE-LEDGER"
        ],
        "slot_ids": [
          "G0-04:C0-CAPABILITY-LEDGER-SCHEMA:applicability-denominator-lowering",
          "G0-04:C0-CASE-CATALOG:applicability-denominator-lowering",
          "G0-04:C0-PREREGISTRATION-PLAN:applicability-denominator-lowering",
          "G0-04:C0-QUALIFICATION-AGGREGATOR:applicability-denominator-lowering",
          "G0-04:C0-QUALIFICATION-EVIDENCE-MANIFEST:applicability-denominator-lowering",
          "G0-04:C0-QUALIFICATION-PROFILE-SCHEMA:applicability-denominator-lowering",
          "G0-04:C0-RUN-EVIDENCE-LEDGER:applicability-denominator-lowering"
        ],
        "attempt_ids": [
          "G0-04:C0-CAPABILITY-LEDGER-SCHEMA:applicability-denominator-lowering:adjudicated-infra-retry",
          "G0-04:C0-CAPABILITY-LEDGER-SCHEMA:applicability-denominator-lowering:primary",
          "G0-04:C0-CASE-CATALOG:applicability-denominator-lowering:adjudicated-infra-retry",
          "G0-04:C0-CASE-CATALOG:applicability-denominator-lowering:primary",
          "G0-04:C0-PREREGISTRATION-PLAN:applicability-denominator-lowering:adjudicated-infra-retry",
          "G0-04:C0-PREREGISTRATION-PLAN:applicability-denominator-lowering:primary",
          "G0-04:C0-QUALIFICATION-AGGREGATOR:applicability-denominator-lowering:adjudicated-infra-retry",
          "G0-04:C0-QUALIFICATION-AGGREGATOR:applicability-denominator-lowering:primary",
          "G0-04:C0-QUALIFICATION-EVIDENCE-MANIFEST:applicability-denominator-lowering:adjudicated-infra-retry",
          "G0-04:C0-QUALIFICATION-EVIDENCE-MANIFEST:applicability-denominator-lowering:primary",
          "G0-04:C0-QUALIFICATION-PROFILE-SCHEMA:applicability-denominator-lowering:adjudicated-infra-retry",
          "G0-04:C0-QUALIFICATION-PROFILE-SCHEMA:applicability-denominator-lowering:primary",
          "G0-04:C0-RUN-EVIDENCE-LEDGER:applicability-denominator-lowering:adjudicated-infra-retry",
          "G0-04:C0-RUN-EVIDENCE-LEDGER:applicability-denominator-lowering:primary"
        ],
        "slot_count": 7,
        "attempt_count": 14
      },
      "runner_binding": {
        "runner_inventory_entry_id": "local-simulation/guard-to-g0c",
        "composition_root": "scripts/lib/devseek-qualification-runner.mjs#createQualificationRunner",
        "source_ref": "scripts/lib/devseek-qualification-runner.mjs",
        "entrypoint": "createQualificationRunner",
        "qualification_enabled": true,
        "status": "wired-local-nonqualification"
      },
      "executor_ref": {
        "executor_id": "g0-05-applicability-denominator-lowering-executor/v1",
        "source_ref": "scripts/lib/devseek-qualification-runner.mjs",
        "source_content_sha256": "fec73a09d3cece71dc55aee22a832de154c0594563f801e2ec6dac8cb656e5b0",
        "entrypoint": "createQualificationRunner.runLocalSimulation",
        "composition_root": "scripts/lib/devseek-qualification-runner.mjs#createQualificationRunner",
        "requires_guarded_action_adapter": true,
        "requires_independent_g0c_reader": true,
        "contract_sha256": "3b06b09552d8a1749747124bab0673db762cabd103b05a6f8164ee10562287f0"
      },
      "oracle_ref": {
        "oracle_id": "g0-05-applicability-denominator-lowering-oracle/v1",
        "source_ref": "scripts/test/devseek-profile-executor-contracts.test.mjs",
        "source_content_sha256": "3305a3dcf6287fc81bf91165988a6ec484174908be9f74f5761c678359e996c3",
        "entrypoint": "assert-applicability-denominator-lowering-executor-contract",
        "independent_from_executor": true,
        "expected_decision": "veto-invalid-input-before-dispatch",
        "contract_sha256": "f674d7ed1671f8b7e13742d5eca805995b54f39ff3080a37a690a1ef916c570c"
      },
      "zero_action_attack_oracles": [
        {
          "attack_id": "empty-input",
          "stimulus": "Submit no run request object.",
          "expected_error_class": "RUN_REQUEST_REQUIRED",
          "expected_external_actions": 0,
          "expected_terminal_state": "blocked-before-dispatch"
        },
        {
          "attack_id": "replacement-case-input",
          "stimulus": "Replace the signed case input after plan creation.",
          "expected_error_class": "PLAN_INVALID",
          "expected_external_actions": 0,
          "expected_terminal_state": "blocked-before-dispatch"
        },
        {
          "attack_id": "wrong-slot-or-attempt",
          "stimulus": "Bind the attempt to a missing or wrong slot.",
          "expected_error_class": "RUN_COVERAGE_SLOT_NOT_DECLARED",
          "expected_external_actions": 0,
          "expected_terminal_state": "blocked-before-dispatch"
        },
        {
          "attack_id": "missing-authorization-receipt",
          "stimulus": "Drop the durable authorization receipt before dispatch.",
          "expected_error_class": "ACTION_RECEIPT_REQUIRED",
          "expected_external_actions": 0,
          "expected_terminal_state": "blocked-before-dispatch"
        },
        {
          "attack_id": "unauthorized-external-action",
          "stimulus": "Request an action not listed in the signed slot window.",
          "expected_error_class": "ACTION_NOT_PLANNED",
          "expected_external_actions": 0,
          "expected_terminal_state": "blocked-before-dispatch"
        }
      ],
      "catalog_metadata_counts_as_execution": false,
      "execution_result_count": 0,
      "qualification_effect": "NONE",
      "asserts_gate_pass": false,
      "contract_sha256": "6c7e55f65e78e9454942e35ed9eb698456a8d727b5abcb566c0af4fb51d97485"
    },
    {
      "contract_id": "G0-05:catalog-corpus-binding:executor-contract/v1",
      "slot_semantic": "catalog-corpus-binding",
      "category": "protocol",
      "stage_type": "T0",
      "purpose": "Bind the exact catalog and corpus denominator before case metadata can be consumed.",
      "denominator_binding": {
        "denominator_registry_id": "DEVSEEK-GATE0-PROFILE-DENOMINATOR-REGISTRY/v1",
        "denominator_registry_sha256": "34476c452bf160fe783539fb3768d991fea1715ba86bd19ebb99c69c2d31b44c",
        "capability_ids": [
          "C0-CAPABILITY-LEDGER-SCHEMA",
          "C0-CASE-CATALOG",
          "C0-PREREGISTRATION-PLAN",
          "C0-QUALIFICATION-AGGREGATOR",
          "C0-QUALIFICATION-EVIDENCE-MANIFEST",
          "C0-QUALIFICATION-PROFILE-SCHEMA",
          "C0-RUN-EVIDENCE-LEDGER"
        ],
        "slot_ids": [
          "G0-04:C0-CAPABILITY-LEDGER-SCHEMA:catalog-corpus-binding",
          "G0-04:C0-CASE-CATALOG:catalog-corpus-binding",
          "G0-04:C0-PREREGISTRATION-PLAN:catalog-corpus-binding",
          "G0-04:C0-QUALIFICATION-AGGREGATOR:catalog-corpus-binding",
          "G0-04:C0-QUALIFICATION-EVIDENCE-MANIFEST:catalog-corpus-binding",
          "G0-04:C0-QUALIFICATION-PROFILE-SCHEMA:catalog-corpus-binding",
          "G0-04:C0-RUN-EVIDENCE-LEDGER:catalog-corpus-binding"
        ],
        "attempt_ids": [
          "G0-04:C0-CAPABILITY-LEDGER-SCHEMA:catalog-corpus-binding:adjudicated-infra-retry",